{
  "schemaVersion": 1,
  "contractId": "G3_FORWARD_RECONCILIATION_EXCEPTION_R1",
  "status": "NON_EXECUTABLE_DESIGN_REQUIRES_SEPARATE_APPROVAL",
  "gateFamily": "G3",
  "actionId": "G3_FORWARD_SCHEMA11_BASELINE_ADOPTION_R1",
  "scope": "PROSPECTIVE_ADMISSION_OF_EXISTING_SCHEMA11_ONLY",
  "references": {
    "g2Contract": "docs/operations/g2-minimal-release-contract.v1.json",
    "g2ContractSha256": "sha256:0caa171096e0447ad5e6cc23043aea9ef129d32eb0375cf903d1be61e92568b9",
    "evidenceContract": "docs/operations/g3-forward-adoption-evidence-and-contract.r1.json",
    "g3_02Method": "https://github.com/JENN2046/jenn-shooting-operations/issues/59#issuecomment-6074360103",
    "g3_03Acceptance": "https://github.com/JENN2046/jenn-shooting-operations/issues/57#issuecomment-6074619277",
    "historicalRecord": "docs/operations/g3-authority-binding-reconciliation.r1.json"
  },
  "historicalFacts": {
    "g3PhysicalOutcome": "COMMITTED",
    "g3GovernanceStatus": "RECONCILIATION_REQUIRED",
    "g3ApprovalHead": "a4199fdb14808ebb866943148a222b0d4300d66e",
    "g3ExecutionHead": "b9dd595eb52bd09f7a8e2115a48ac401389f5b73",
    "historicalBindingCompliant": false,
    "originalExecutionReplayIdentityReusable": false,
    "oldRollbackOutcome": "UNKNOWN",
    "oldRollbackAttemptSha256": "sha256:bfd40da521d2a3871ffcf4b4913de260d51c368eeca0ca775c4bda6b25b5645a",
    "oldRollbackReplayIdentityReusable": false,
    "historicalReceiptsMutable": false
  },
  "method": {
    "trustModel": "TRUSTED_HOST_ADMIN",
    "trustDecision": "https://github.com/JENN2046/jenn-shooting-operations/issues/58#issuecomment-6062729313",
    "containment": "TWO_ORIGINAL_IMMUTABLE_INODES_FULL_PARENT_CUSTODY_AND_EXISTING_WRITER_DENY",
    "origin": "PREBOUND_AUTHENTICATED_SSH_ONE_USE_CHALLENGE_EXTERNAL_CUSTODY_STRICT_READBACK",
    "comparison": "PINNED_RAW_FD_MEMORY_ONLY_WAL_NORMALIZATION_NOATIME_APPLICATION_SEMANTICS",
    "optionalSignatureCompatibility": "DEFER_NOT_SELECTED",
    "labEvidenceMaySubstituteForProduction": false,
    "maliciousTrustedRootDefenseClaimed": false
  },
  "targetRequirements": {
    "bindingDomain": "G3_FORWARD_RECONCILIATION_TARGET_R1",
    "canonicalEncoding": "REUSE_EXISTING_SORTED_KEY_UTF8_JSON_AND_SHA256_CONVENTION",
    "digestExcludesApprovalAndReceipts": true,
    "requiredBindings": [
      "exceptionVersionAndExactContractDigest",
      "postMergeCanonicalHead",
      "reviewedExecutorAndVerifierSourceImageRuntimeDigests",
      "approvedTrustMethodAndSourceCustodianAnchors",
      "freshOriginalActiveAndPreservedFdIdentitiesHashesParentChainsAliasesNamespaces",
      "verifiedContainmentThroughCaptureAndClaim",
      "trustedOriginTranscriptAndEvidenceDigest",
      "semanticParityMigrationIdentityAndRecoveryReadback",
      "immutableHistoricalG3AndConsumedUnknownRollbackDigests",
      "newOperationIdAndExactPacketId",
      "explicitValidityWindow"
    ],
    "authorityAndProofMustPrecedeTargetFreeze": true,
    "latestCanonicalCheckedBeforeClaim": true,
    "postCanonicalLocalRevalidationRequired": true,
    "postClaimNetworkDependencyAllowed": false,
    "unknownOrDriftDisposition": "DO_NOT_CLAIM"
  },
  "approvalRequirements": {
    "separateVersionedExceptionApprovalRequired": true,
    "newExactTargetApprovalRequired": true,
    "trustedApprovalIdentityAndSemanticValidationRequired": true,
    "approvalBindsContractVersionDigestAndTargetDigest": true,
    "approvalMustPrecedeClaimAndBeUnexpired": true,
    "designTaskOrMergeCountsAsExecutionApproval": false,
    "oldApprovalMayAuthorizeFutureAction": false
  },
  "claimRequirements": {
    "durableAppendOnlyLedgerRequired": true,
    "replayIdentity": "operationId+authorityTargetDigest",
    "packetIdPartitionsReplayIdentity": false,
    "claimBindsExactPacketIdAndInstance": true,
    "newOperationIdCannotEqualAnyHistoricalG3OrRollbackId": true,
    "ledgerUnknownOrUnreachableDisposition": "DO_NOT_CLAIM",
    "claimMustBeDurableBeforeNewGovernanceAppend": true,
    "lostClaimAcknowledgementDisposition": "UNKNOWN_CONSUMED_NO_RETRY",
    "automaticRetryAllowed": false,
    "unknownRequiresSeparateHumanReconciliation": true
  },
  "receiptRequirements": {
    "storage": "SEPARATE_APPEND_ONLY_GOVERNANCE_RECEIPTS_UNDER_APPROVED_CUSTODY",
    "requiredBindings": [
      "operationId",
      "authorityTargetDigest",
      "exactPacketId",
      "instanceIdentity",
      "claimDigest",
      "exceptionApprovalDigest",
      "exactHumanApprovalDigest",
      "productionEvidenceDigest",
      "historicalG3AndRollbackDigests",
      "priorAppendDigest",
      "terminalOutcome",
      "terminalTime",
      "independentVerificationDigestAndTime"
    ],
    "subactionOutcomes": [
      "COMMITTED",
      "UNKNOWN"
    ],
    "committedMeaning": "INDEPENDENTLY_VERIFIED_NEW_GOVERNANCE_ADMISSION_ONLY",
    "effectiveAt": "INDEPENDENT_TERMINAL_VERIFICATION_TIME_NOT_BACKDATED",
    "requiredTimeOrder": [
      "exceptionAndExactTargetApproval",
      "durableClaim",
      "newGovernanceAppend",
      "independentTerminalVerification"
    ],
    "noClaimMeansNoTerminalReceipt": true,
    "unclassifiableOrMissingEvidenceOutcome": "UNKNOWN",
    "oldPhysicalOutcomeAndGovernanceRecordsMutable": false,
    "rolledBackDoesNotMeanSqliteRestoreInThisSubaction": true,
    "normalWritesRemainDisabledForEveryOutcome": true
  },
  "currentAuthority": {
    "exceptionApproved": false,
    "targetCreated": false,
    "exactHumanApprovalCreated": false,
    "operationIdentityAllocated": false,
    "claimCreated": false,
    "receiptCreated": false,
    "productionProofAdmitted": false,
    "productionDatabaseMutationAllowed": false,
    "custodyMutationAllowed": false,
    "runtimeGateRelaxationAllowed": false,
    "writerReadmissionAllowed": false,
    "serviceStartAllowed": false,
    "g4Allowed": false,
    "mergeAuthorized": false,
    "g3_05Authorized": false
  }
}
